{
  "contract": "qualify-output-2",
  "decision": "qualified",
  "findings": [
    {
      "obligation_id": "ob-001",
      "requirement_id": "req-01",
      "atom_id": "req-01.a1",
      "quote": "BS or",
      "modality": "required",
      "status": "met",
      "fact_ids": [
        "edu-01"
      ],
      "basis": ""
    },
    {
      "obligation_id": "ob-002",
      "requirement_id": "req-01",
      "atom_id": "req-01.a2",
      "quote": "or MS",
      "modality": "required",
      "status": "met",
      "fact_ids": [
        "edu-02"
      ],
      "basis": ""
    }
  ],
  "undecidable": [],
  "decisive": [],
  "support": [
    "ob-001",
    "ob-002"
  ]
}
